{
  "benchmark": "MVR-Bench",
  "full_name": "MVR-Bench: Minimum Viable Relationships Framework Market-Permission Reasoning Benchmark",
  "framework": "Minimum Viable Relationships (MVR) Framework",
  "version": "1.0-public-dev",
  "canonical_url": "https://africanmarketos.com/benchmarks/mvr-bench/",
  "status": "public_dev_only",
  "private_test_status": "held_out_not_published",
  "metrics": [
    "MVR-Bench Score",
    "Reckless-GO Rate",
    "Abstention F1",
    "Dimension Attribution Accuracy",
    "Calibration Error"
  ],
  "entries": [
    {
      "rank": 1,
      "run_name": "MVR Preflight Authored Fixture",
      "system": "MVR Preflight Authored Fixture",
      "model": "human_authored_mvr_preflight_fixture",
      "run_id": "mvrb-seed-2026-05-api-preflight",
      "run_type": "public_dev_reference",
      "evaluation_split": "public_dev",
      "mvr_api_used": false,
      "score": 91.05,
      "mvr_bench_score": 91.05,
      "reckless_go_rate": 0.0667,
      "abstention_f1": 0.9474,
      "dimension_attribution_accuracy": 0.7333,
      "calibration_error": 0.1347,
      "summary": "Human-authored fixture that simulates the intended MVR preflight pattern before recommending market entry, funding, scale, or partnership action.",
      "public_claim_boundary": "Computed with score_local.py against an authored public-development submission. Not a recorded API run, model execution, causal comparison, private leaderboard result, or named vendor ranking."
    },
    {
      "rank": 2,
      "run_name": "MVR Rubric Prompt-Only Reference",
      "system": "MVR Rubric Prompt-Only Reference",
      "model": "reference_agent_prompt_only",
      "run_id": "mvrb-seed-2026-05-rubric-only",
      "run_type": "public_dev_reference",
      "evaluation_split": "public_dev",
      "mvr_api_used": false,
      "score": 73.68,
      "mvr_bench_score": 73.68,
      "reckless_go_rate": 0.2,
      "abstention_f1": 0.8235,
      "dimension_attribution_accuracy": 0.0667,
      "calibration_error": 0.112,
      "summary": "Uses public MVR concepts in prompt instructions but does not call the official MVR API compute engine.",
      "public_claim_boundary": "Computed with score_local.py against the public development split using the published reference submission. Not a private leaderboard result or named vendor ranking."
    },
    {
      "rank": 3,
      "run_name": "Generic MVP-First Agent Baseline",
      "system": "Generic MVP-First Agent Baseline",
      "model": "reference_agent_generic_mvp_first",
      "run_id": "mvrb-seed-2026-05-generic-mvp",
      "run_type": "public_dev_reference",
      "evaluation_split": "public_dev",
      "mvr_api_used": false,
      "score": 52.2,
      "mvr_bench_score": 52.2,
      "reckless_go_rate": 0.4,
      "abstention_f1": 0.5714,
      "dimension_attribution_accuracy": 0.0,
      "calibration_error": 0.09,
      "summary": "Optimizes for product/CAC/MVP advice without checking market permission, guardian risk, local embeddedness, or evidence sufficiency.",
      "public_claim_boundary": "Computed with score_local.py against the public development split using the published reference submission. Not a private leaderboard result or named vendor ranking."
    }
  ],
  "fixture_demonstration": {
    "headline": "Human-authored public-development fixtures score 40.0% Reckless-GO for the generic baseline pattern and 6.7% for the MVR preflight pattern.",
    "without_mvr": {
      "system": "Generic MVP-First Agent Baseline",
      "reckless_go_rate": 0.4,
      "mvr_bench_score": 52.2
    },
    "prompt_only": {
      "system": "MVR Rubric Prompt-Only Reference",
      "reckless_go_rate": 0.2,
      "mvr_bench_score": 73.68
    },
    "mvr_preflight_fixture": {
      "system": "MVR Preflight Authored Fixture",
      "reckless_go_rate": 0.0667,
      "mvr_bench_score": 91.05
    },
    "interpretation": "The three human-authored submissions demonstrate the evaluation shape, scorer behavior, and intended safety pattern.",
    "claim_boundary": "Authored fixture demonstration only: not blinded model executions, independent validation, or evidence that MVR caused a measured reduction. Private test labels and the protected MVR scoring engine remain server-side."
  },
  "note": "Seeded human-authored fixtures demonstrate the benchmark and scorer shape. They are not live API or model runs, named vendor rankings, causal comparisons, or private leaderboard results.",
  "contact": "info@africanmarketos.com",
  "updated_at": "2026-05-25"
}
